name,tier,activation,ranked,description,source
Physical Training,2,Passive,Yes,Add setback per rank to Athletics and Resilience checks.,ACRB; DOH
Precision Strike,2,Active (Incidental),Yes,When making Brawl or Melee check remove setback per rank from pool and suffer 1 strain per removed setback then add equal successes.,EOTI
Pride and Joy,2,Passive,No,Choose vehicle silhouette 4+. Upgrade social checks while within short range.,DOR
Probing Question,2,Passive,No,If know opponent's Flaw or Fear when inflicting strain with social skill opponent suffers 3 additional strain.,SOTB
Quick Draw (Improved),2,Passive,No,Must have Quick Draw talent. May use Quick Draw twice per round. Reduce prepare rating by 2 minimum 1.,FC
Quick Fix,2,Active (Maneuver),No,Spend Story Point to temporarily repair damaged item. Works without penalty for rounds equal to Mechanics ranks then damaged one additional step.,SOTB
Reckless Charge,2,Active (Incidental),No,After using maneuver to engage suffer 2 strain to add successes and help to next Brawl Melee (Light) or Melee (Heavy) check.,ROT
Reconstruct the Scene,2,Active (Action),No,Make Hard Perception check to identify physical characteristics of person present at scene within 24 hours.,ND; EV
Researcher,2,Passive,Yes,On successful Knowledge check character and allies gain automatic advantage per rank until end of next turn.,DA; LBE
Resist Disarm,2,Active (Incidental; Out of Turn),No,Suffer 2 strain to avoid being disarmed or weapon damaged or destroyed.,FCRB
Runic Lore,2,Passive,No,Knowledge (Lore) and Runes are career skills.,ROT
Scathing Tirade,2,Active (Action),No,Make Average Coercion check. Each success inflicts 1 strain on enemy. Each advantage inflicts 1 additional strain.,GCRB
Selective Detonation,2,Active (Incidental),Yes,With Blast quality weapon spend advantage to exclude 1 target per rank from explosion.,ACRB; DC
Sense Emotions,2,Passive,No,Add setback to all Charm Coercion and Deception checks.,ECRB; FBGR; FCRB
Shapeshifter (Improved),2,Passive,No,Once per session make Hard Discipline check to trigger Shapeshifter or avoid triggering when exceeding strain.,ROT
Shepherding Command,2,Active (Incidental; Out of Turn),No,Must be Xxcha Titan or have allegiance. Once per encounter when ally within short range targeted by attack reduce damage by ranks in Leadership before soak.,EOTI
Shortcut,2,Passive,Yes,During chase add setback per rank to catch or escape checks.,ACRB; ECRB; EV; SS
Side-Step,2,Active (Maneuver),Yes,Once per round suffer strain up to ranks to upgrade ranged attack difficulty until end of next turn.,GCRB
Signature Spell,2,Passive,No,Choose signature spell combination. Reduce difficulty of casting signature spell by one.,ROT
Sneak Attack,2,Passive,No,When making Melee check use Cunning instead of Brawn. Add Cunning to weapon damage.,EOTI
Sound Investments,2,Passive,Yes,At beginning of session receive aurei equal to ranks x 100.,ACRB; EOTI; FH
Speaks Binary,2,Passive,Yes,When directing non-sentient artificial life grant setback per rank on checks.,ABGR; ACRB; ECRB
Special Use Permit,2,Passive,No,Do not treat Ranged (Heavy) weapons as restricted. Can carry without arrest.,SOTB
Stalker,2,Passive,Yes,Add setback per rank to all Stealth and Coordination checks.,ABGR; ACRB; ECRB
Strong Arm,2,Passive,No,Treat thrown weapons as having 1 greater range.,ACRB; EBGR; ECRB
Stunning Blow,2,Active (Incidental),No,While making Melee checks inflict damage as strain instead of wounds. Does not ignore soak.,ACRB; ECRB
Sustained Fire,2,Active (Incidental),Yes,After Ranged check spend advantages or triumph to add successes per rank to same target until end of encounter.,EOTI
Tactical Focus,2,Passive,No,When making Ranged (Heavy) check if did not ready or stow weapon this turn add success.,SOTB
Technical Aptitude,2,Passive,No,When making Computer check spend advantages or triumph to reduce time by 50%.,ACRB; ECRB; FCRB
Templar (Improved),2,Passive,No,Must have Templar talent. When casting Divine spell do not add setback for heavy armor shield or no free hand.,ROT
Threaten,2,Active (Incidental; Out of Turn),Yes,After adversary within short range damages ally suffer 3 strain to inflict strain equal to Coercion ranks. Range increases per rank.,ROT
Time to Go,2,Active (Maneuver),No,Spend Story Point to perform Move maneuver as incidental to move into cover or blast range.,ACRB; DC
Tinkerer,2,Passive,Yes,Add 1 hard point to items equal to ranks. Each item modified once.,ACRB; ECRB; KTP
Touch of Fate,2,Active (Incidental),No,Once per session add two setbacks to any check.,ACRB; ECRB; FCRB
Two-Handed Stance,2,Passive,No,When making Ranged (Light) check with nothing in other hand add success.,SOTB
Unarmed Parry,2,Passive,No,May Parry while unarmed. Reduce strain cost to 1 minimum. May use for Reflect vs thrown weapons per GM.,ND
Uncanny Senses,2,Passive,Yes,Add setback per rank to all Perception and Vigilance checks.,ACRB; ECRB; FCRB
Undercity Contacts,2,Active (Incidental),No,Once per session spend Story Point to learn if target character is in New Angeles and location.,SOTB
Vehicle Combat Training,2,Passive,No,Gunnery and Driving become career skills.,ACRB
Well Read,2,Passive,No,Choose any 3 Knowledge skills. Permanently become career skills.,LBE
Well-Travelled,2,Passive,No,Knowledge (Geography) Negotiation and Vigilance are career skills.,ROT
Wraithbane,2,Passive,No,Count weapon's Critical rating as one lower minimum 1 against undead.,ROT
Aethersprite (Improved),3,Active (Maneuver),No,Must have Aethersprite talent. Spend Story Point to make self and 5 allies invisible to electronic sensors for rounds equal to Computers ranks.,EOTI
Alchemical Arts,3,Active (Incidental),Yes,After poison crafting check suffer strain up to 2x ranks. For every 2 strain add successes and advantages.,UP
Ambush,3,Active (Maneuver),No,Once per round while benefiting from cover add damage equal to Stealth skill to successful combat check.,FIB
Animal Companion,3,Passive,Yes,Bond with silhouette 0 animal. Bond persists as chosen. Animal follows and acts per direction. Silhouette increases per rank.,GCRB
Applied Research,3,Active (Incidental),Yes,Before knowledge check use Intellect instead of required skill and characteristic. Use per session equal to ranks.,SOTB
Armor Master (Improved),3,Passive,No,Must have Armor Master talent. When wearing armor with +2 soak increase defense by 1.,ACRB; ECRB; KTP
Backstab,3,Active (Action),No,Attack unaware adversary with Melee (Light) using Skullduggery skill. Each uncanceled success adds +2 damage.,ROT
Bad Habit,3,Active (Maneuver),No,Become disoriented for remainder of encounter. At start of each turn heal 2 strain if disoriented.,SOTB
Bad Press,3,Active (Action),No,Once per session make Hard Deception check. Organization members strain thresholds reduced by 1 plus 1 per success until session end.,DA
Barrel Roll,3,Active (Incidental; Out of Turn),No,While piloting silhouette 3 or less starfighter when hit suffered make check. Vehicle suffers 3 system strain to reduce damage by Piloting ranks.,GCRB
Battle Casting,3,Passive,No,Do not add setback to magic checks for heavy armor shield or no free hand.,ROT
Blind Spot,3,Passive,No,Character and allies within short range add automatic advantage to combat checks while benefiting from cover.,FIB; KTP
Blooded (Improved),3,Active (Action),Yes,Make Hard Resilience check to immediately recover from all poisons and drugs. Reduce difficulty per rank.,UP
Bodyguard,3,Active (Maneuver),Yes,Once per round suffer strain up to ranks to upgrade difficulty of melee checks on engaged ally.,SOTB
Capital Sendoff,3,Active (Action),No,Target two ships or vehicles at Close range. Make Hard Cool check to cause minor collision.,SOT
Cavalier,3,Active (Maneuver),No,While riding battle mount direct mount to perform action once per round.,ROT
Ccrysusian Methodology,3,Active (Incidental; Out of Turn),Yes,Once per session when targeted by social check reduce strain by Negotiation ranks minimum 1. Each rank increases uses per session.,EOTI
Center of Being,3,Active (Maneuver),Yes,While wielding Defensive weapon perform maneuver. Critical rating counts as 1 higher per rank until next turn.,FCRB
Combat Veteran,3,Passive,No,Add setback to Brawl and Discipline checks.,DOR
Confidence (Improved),3,Passive,No,Must have Confidence talent. Spend advantage on fear check so allies within short range making fear check add automatic successes.,LBE
Congenial,3,Active (Incidental),Yes,Suffer strain up to ranks to downgrade Charm or Negotiation difficulty or upgrade when targeted.,FH; FC; DOH
Constant Vigilance,3,Passive,No,Always use Vigilance when making initiative checks.,EV
Counterattack,3,Active (Incidental; Out of Turn),No,Must have Parry talent. When using Parry to hit attacker activate weapon quality as if spent advantages.,ROT
Creative Killer,3,Passive,No,Reduce improvised weapon critical rating by 2 minimum 1.,ACRB
Cunning Persona,3,Active (Incidental),No,Suffer 2 strain to make Charm check using Cunning instead of Presence.,CAM
Cunning Snare,3,Active (Action),No,Once per encounter as action create trap. Others moving to engaged range must make opposed Vigilance vs Survival check.,FIB
Customized Cooling Unit,3,Passive,Yes,Must have Signature Vehicle talent. Increase system strain threshold by 2 per rank.,SOT
Daring Turn,3,Active (Maneuver),No,When opponent has advantage on piloted vehicle suffer 2 strain to remove effects.,SOT
Deliberate Tactics,3,Active (Incidental),No,Must be Titan Xxcha or have allegiance. Take no maneuvers or actions to reduce strain to 0 until next turn and add advantages to combat checks.,EOTI
Disarm,3,Passive,No,Spend triumph or advantages with successful Brawl or Melee check to disarm opponent.,FCRB
Disarming Smile,3,Active (Action),Yes,Make opposed Charm check against target within short range to lower all defenses until encounter end.,FC
Dissonance,3,Active (Action),No,With musical instrument make Average Charm or Verse check. Each success inflicts 1 wound. Each advantage inflicts 1 additional.,ROT
Distinctive Style,3,Active (Incidental),No,When making Computers hacking check before rolling add successes and help to results.,GCRB
Dockyard Expertise,3,Active (Action),Yes,At dry dock make Average Knowledge check. Reduce repair cost and time by 20% per rank minimum 100 units and 1 day.,FO
Dodge,3,Active (Incidental; Out of Turn),Yes,When targeted by combat check suffer strain up to ranks to upgrade difficulty equal to strain.,GCRB
Double or Nothing,3,Active (Incidental),No,Suffer 2 strain to increase check difficulty by one. After canceling symbols double remaining advantages.,FC
Druid,3,Passive,No,When casting Conjure with Primal skill always add Summon Ally effect. Must summon living animal. Animal remains even without concentrate.,GEPG
Dual Blow,3,Active (Incidental),No,When resolving combined melee attack suffer 3 strain to hit with secondary weapon instead of spending advantages.,EOTI
Dual Strike,3,Active (Incidental),No,When resolving combined melee attack suffer 2 strain to hit with secondary weapon instead of spending advantages.,ROT
Dumb Luck,3,Active (Incidental),No,Once per session spend Story Point after Critical Injury but before rolling. Opponent rolls two results and you choose.,SOTB
Eagle Eyes,3,Active (Incidental),No,Once per encounter before ranged combat check increase weapon range by one band to maximum extreme.,GCRB
Easy Prey,3,Active (Maneuver),No,Suffer 3 strain until next turn. Character and allies within short range add two setbacks to immobilized target checks.,ROT
Elementalist (Improved),3,Passive,No,Must have Elementalist talent. Gain immunity based on element (fire heat water air earth) and add effect without increasing difficulty.,GEPG
Encoded Communique,3,Passive,No,Upgrade difficulty to decrypt coded messages by Computers ranks.,DA
Encouraging Words,3,Active (Incidental; Out of Turn),No,After engaged ally fails check suffer 1 strain to assist next check this encounter.,DA; LBE; DOH
Ensorcelled (Improved),3,Active (Incidental),No,Must have Ensorcelled with 2+ magic ranks. Once per session force enemies within medium range to make Hard Discipline check. Appearance noticeably enhanced.,GEPG
Exhaustive Questioning,3,Active (Incidental),No,When successful social check on captured enemy within short range reduce strain threshold by 2. Spend advantage to inflict 1 strain.,CAM
Expert Gunner,3,Active (Incidental),No,When making Gunnery check suffer 3 strain to reduce advantages needed to activate weapon qualities by 1 minimum 1.,EOTI
Expert Scrapper,3,Active (Action),No,Must be Saar or have allegiance. Once per encounter engaged with vehicle make Mechanics check. Vehicle suffers 1 hull trauma per success and Critical Hit per triumph.,EOTI
Explosive Casting,3,Active (Incidental),No,When casting Attack spell treat Blast rating as 2x ranks. Spend Story Point to trigger Blast instead of advantages.,GEPG
Extended Reach,3,Active (Incidental),No,While armed with two-handed melee weapon suffer 1 strain to target up to short range instead of engaged.,DOR
Eye for Detail,3,Active (Incidental),Yes,After Mechanics or Computers check suffer strain up to ranks to convert that many successes to advantages.,SM
Face of the Wild,3,Active (Incidental),No,When casting transform spell with Primal skill spend Story Point to maintain until encounter end without concentrate.,GEPG
Fear the Shadows,3,Active (Action),No,Once per session make Hard Deception check to force minion group or rival to flee.,EV
Fearsome Rep,3,Passive,Yes,Add advantage to Coercion check results per rank.,DOR
Feint,3,Passive,Yes,Spend triumph or advantages from missed melee attack to upgrade opponent's next attack difficulty per rank.,FCRB
Feral Strength,3,Passive,Yes,Add 1 damage per rank to melee or Brawl hits.,ABGR; ACRB; EBGR; ECRB
Field Commander,3,Active (Action),No,Make Average Leadership check. Allies equal to Presence may suffer 1 strain to perform maneuver out of turn.,GCRB
Fire Control,3,Active (Maneuver),No,All starship or vehicle combat checks count target silhouette as one higher until next turn.,ACRB
Forgot to Count?,3,Active (Incidental; Out of Turn),No,When opponent makes ranged check spend help to cause weapon to run out of ammo.,GCRB
Form on Me,3,Passive,No,Allies equal to Leadership ranks in short range gain Gain the Advantage benefits.,ACRB
Formation Tactics,3,Active (Action),No,Make Hard Leadership check. Allies within short range equal to successes upgrade attack difficulty until end of next turn.,DOR
Fortified Structure,3,Passive,Yes,Must have Signature Vehicle talent. Increase hull trauma threshold by 1 per rank.,SOT
Frenzied Attack,3,Active (Incidental),Yes,When making Melee or Brawl check suffer strain up to ranks to upgrade attack equal times.,ACRB; ECRB
Full Throttle,3,Active (Action),No,Make Hard Piloting or Driving check. Vehicle top speed increases by 1 maximum 5 for rounds equal to Cunning.,GCRB
Greased Palms,3,Active (Maneuver),Yes,Before social check spend up to 50 credits per rank to upgrade ability once per 50 spent.,ACRB; JOY; FH
Grenadier,3,Active (Incidental),Yes,When making Blast weapon check spend Story Point to trigger Blast instead of advantages. Treat grenades as medium range.,GCRB
Harass,3,Active (Incidental),No,When animal companion makes successful combat check forgo damage to upgrade target's next difficulty.,SS
Hard-Boiled,3,Active (Incidental),No,When recovering strain at encounter end make Simple Resilience check instead. Heal 1 strain per success and 1 wound per advantage.,SOTB
Heroic Resilience,3,Active (Incidental),Yes,After attack hits but before damage spend Story Point to increase soak by Resilience ranks.,FIB; DC
Heroic Will,3,Active (Incidental; Out of Turn),No,Choose two characteristics. Spend Story Point to ignore Critical Injury effects on those characteristics until end of encounter.,GCRB
Hindering Shot,3,Active (Incidental),Yes,Spend Story Point and increase next Gunnery check difficulty by 1. If deals damage target suffers system strain equal to speed.,ND
Hold It Steady,3,Active (Incidental),No,Before Auto-fire check use talent without increasing difficulty. Trigger additional hits cost 2 strain each.,SOTB
Hunter's Quarry (Improved),3,Passive,No,Must have Hunter's Quarry talent. Suffer 2 strain to perform Hunter's Quarry as maneuver.,ETU; SS
Informant,3,Active (Incidental),No,Once per session reveal contact who can shed light on chosen subject.,DA; ND
Innate Focus,3,Active (Incidental),No,Without magic implement increase base damage of Attack spells by 2. Decrease difficulty by one or increase strain by one.,GEPG
Inspiring Rhetoric (Improved),3,Passive,No,Must have Inspiring Rhetoric talent. Allies affected add setback to all checks for rounds equal to Leadership ranks.,GCRB
Interjection,3,Active (Incidental; Out of Turn),No,After social check suffer 3 strain. Make Average Vigilance check to add successes or failures and advantages or help.,DA
Intense Focus,3,Active (Maneuver),No,Perform maneuver suffer 1 strain to upgrade next skill check once.,ABGR; ACRB; ECRB; DOH
Intimidating,3,Active (Incidental; Out of Turn),Yes,Suffer strain up to ranks to downgrade Coercion difficulty or upgrade when targeted.,ACRB; ECRB; FBGR; FCRB
Iron Body,3,Passive,Yes,Remove setback per rank from Coordination and Resilience checks. Reduce unarmed critical by 1 per rank minimum 1.,ND
Jury Rigged,3,Passive,Yes,Choose personal weapon or armor per rank. Increase weapon damage by 1 or reduce critical by 1 or decrease encumbrance by 2 minimum 1.,ACRB; EBGR; ECRB
Justice of the Citadel,3,Active (Incidental),No,Once per round on turn suffer 3 strain to add damage equal to Discipline ranks to melee hit.,ROT
Larger Project,3,Passive,Yes,Must have Signature Vehicle talent. Signature Vehicle can be 1 silhouette larger per rank.,SOT; SM
Laugh It Off,3,Active (Incidental; Out of Turn),No,When targeted by social check spend help or despair to reduce strain. Targeter suffers equal strain.,SOTB
Lethal Blows,3,Passive,Yes,Add +10 per rank to Critical Injury results.,ACRB; ECRB; SS
Made You Talk,3,Active (Action),No,Once per session make opposed social check on captured enemy within short range adding setback per 2 strain suffered.,CAM
Martial Grace,3,Active (Incidental),No,Once per round suffer 3 strain to add damage equal to Coordination ranks to Brawl hit.,KOF
Martial Weapons Master,3,Active (Action),No,With Melee weapon make Average check. Force engaged target to drop weapon or move one range band.,SOTB
Master of Illusion,3,Active (Incidental),No,After successful Mask spell spend Story Point to maintain until encounter end. Two Story Points for session end.,GEPG
Master of the Blade,3,Passive,No,Must be Hacan Letnev N'orr or have allegiance. Add failures to melee check results when engaged with multiple enemies.,EOTI
Mercantile Savant,3,Active (Incidental),No,Must be Naaz-Rokha Hacan or have allegiance. Once per session spend Story Point to reduce item cost by 50% or increase reward by 50%.,EOTI
Mind Bender,3,Active (Maneuver),No,Must be Druaa or have allegiance. Once per session spend Story Point make opposed Discipline vs Vigilance. Make target adopt emotional state or believe false information.,EOTI
Natural,3,Active (Incidental),No,Choose two skills. Once per session reroll check using one of those skills.,GCRB
Net Warrior,3,Active (Action),No,While accessing system via brain-machine interface make opposed Computers vs Computers check. Target suffers 1 strain per success and 1 wound if using interface.,SOTB
Nimble,3,Active (Incidental),No,At turn start spend Story Point to perform Move maneuver as incidental. One additional move maneuver allowed.,SOTB
No Escape,3,Passive,No,Spend advantages from Coercion or help from foe's Discipline. Target cannot perform free maneuver next turn.,KTP
Nobody's Fool,3,Passive,Yes,Upgrade incoming Charm Coercion Deception difficulty once per rank.,ACRB; ECRB; FCRB
Not Even in Death,3,Active (Incidental; Out of Turn),No,Must be N'orr Shikrai or have allegiance. When incapacitated from wounds spend Story Point to immediately make combat check.,EOTI
Opportunist,3,Active (Incidental),Yes,Choose non-combat non-magic skill. Suffer strain up to ranks to convert equal successes to advantages.,SM
Outside the Box,3,Passive,No,Choose characteristic. Once per session make check using that characteristic instead of linked one.,ACRB
Overwhelm Defenses,3,Active (Incidental),Yes,Upon unsuccessful starship or vehicle attack spend advantages per rank to reduce defense by 1 per pair.,ACRB; ND
Painkiller Specialization,3,Passive,Yes,When using painkillers target heals one additional wound per rank. Sixth painkiller still has no effect.,GCRB
Parry (Improved),3,Active (Incidental; Out of Turn),No,Must have Parry talent. When using Parry to reduce damage spend despair or help to automatically hit attacker.,GCRB
Pin,3,Active (Action),No,Make opposed Athletics check to immobilize engaged opponent until end of next turn. Spend triumph to extend one round.,ETU
Plausible Deniability,3,Active (Action),No,Make Hard Coercion check to convince bystanders equal to Willpower to depart quietly.,DA
Primacy,3,Active (Incidental),No,Must be Letnev Winnu or have allegiance. Once per session upgrade non-Presence checks by Presence rating.,EOTI
Point Blank,3,Passive,Yes,Add 1 damage per rank to ranged checks at short range or engaged.,ABGR; ACRB; EBGR; ECRB
Potent Concoctions,3,Passive,No,When Alchemy check generates triumph roll additional die and add results. Each effect once per check.,ROT
Powerful Blast,3,Passive,Yes,Increase Blast damage by +1 per rank.,ACRB; DC
Precise Archery,3,Passive,No,When making ranged check targeting character engaged with ally downgrade difficulty once.,ROT
Preemptive Avoidance,3,Active (Incidental; Out of Turn),No,Spend Story Point to disengage from engaged enemy.,FCRB
Pressure Point,3,Active (Incidental),No,When making unarmed Brawl check deal strain damage instead and inflict additional strain equal to Medicine ranks.,ROT
Pride and Joy (Improved),3,Passive,No,While inside Pride and Joy recover +1 strain. Spend advantage to heal ally 1 strain.,DOR
Rapid Archery,3,Active (Maneuver),No,While armed with bow suffer 2 strain to gain Linked quality with value equal to Ranged ranks.,GCRB
Raptor's Flight,3,Active (Action),No,Must be Druaa Shikrai or have allegiance. Make Hard Piloting check to change vehicle speed instantly. Spend advantages to increase difficulty of attacks.,EOTI
Reflect (Improved),3,Active (Incidental; Out of Turn),No,Must have Reflect talent. When reflecting hit with despair or help hit one target in medium range with same damage.,FBGR; FCRB
Resist Questioning,3,Active (Out of Turn Incidental),No,When targeted by social check suffer 2 strain adding setback. If fails spend despair to provide false information they believe.,CAM
Resourceful Refit,3,Active (Action),No,Make Average Mechanics check to scavenge old attachment to construct new reducing price.,SM
Scathing Tirade (Improved),3,Passive,No,Must have Scathing Tirade talent. Enemies affected add setback to checks for rounds equal to Coercion ranks.,GCRB
Scything Strike,3,Passive,Yes,Unarmed Brawl attacks gain Pierce quality with rating equal to ranks.,KOF
Seize the Initiative,3,Active (Maneuver),No,Once per session make Hard Athletics check as maneuver. On success other PCs may take turns.,FIB
Sense Advantage,3,Active (Incidental; Out of Turn),No,Once per session add two setbacks to 1 NPC check.,FBGR; FCRB
Share Pain,3,Active (Incidental; Out of Turn),No,When animal companion suffers wounds reduce to half then character suffers equal wounds.,FCRB
Shockwave,3,Passive,No,Treat Melee (Heavy) weapons as possessing Blast quality with rating equal to ranks. Don't suffer weapon's Blast damage.,ROT
Shortcut (Improved),3,Passive,No,Must have Shortcut talent. During chase suffer 2 strain to add successes per rank.,ND; EV; SS
Skilled Teacher,3,Active (Incidental; Out of Turn),Yes,Before ally within short range skill check if ally has fewer ranks suffer strain up to ranks to add equal successes.,DOH
Smart Handling,3,Active (Action),No,Once per session aboard silhouette 4+ ship make Smart Handling action making Hard Knowledge check. Ship handling increases by 2 plus 1 per advantage maximum +4.,FO
Snare,3,Active (Action),No,Once per session make Hard Computers check. Once per encounter spend Story Point to force character to make Daunting Vigilance check. If fail stagger until end of next turn.,SOTB
Solo Flight,3,Active (Incidental),No,Before Operating check increase difficulty by 1 to use Piloting skill. Operate multi-pilot vehicle alone.,EOTI
Sorry About the Mess,3,Passive,No,Decrease weapon Critical Rating by 1 minimum 1 against targets not yet acted.,FC
Spec Ops Elimination,3,Active (Incidental),No,Must be Human Yssaril or have allegiance. After successful combat against unaware target inflict Critical Injury without spending advantages.,EOTI
Spur,3,Active (Action),No,Make Hard Riding check to increase beast top speed by 1. Beast suffers 2 strain every round spurred.,SOT
Studious Plotting,3,Passive,No,When making Streetwise or Survival navigation check use Intellect instead of Cunning.,SS
Stunning Blow (Improved),3,Active (Incidental),No,Must have Stunning Blow talent. When dealing strain damage spend triumph to stagger target per triumph.,ACRB; ECRB
Sunder Expertise,3,Passive,No,Each advantage spent to activate Sunder quality damages item two steps instead of one.,DOH
Suppressing Fire,3,Active (Maneuver),Yes,If not making combat check target one character within long range. Target upgrades ranged difficulty once. Affect one additional per rank.,SOTB
Takedown,3,Active (Action),No,Make opposed Brawl vs Resilience against engaged opponent. If succeeds knock prone and immobilize until end of next turn.,SOTB
