name,tier,activation,ranked,description,source
Specialist Knowledge,1,Passive,Yes,Choose specific expertise area. Reduce Knowledge check difficulty once for that area.,CCC-Tom Cruise
Street Slang,1,Active (Incidental),Yes,When making social check in criminal company suffer strain up to ranks to add equal advantages.,CCC-Klort
Covert Infiltration Training,1,Passive,No,Computers or Skullduggery become career skill. Spend 2 advantages to leave security device undamaged.,CCC-GM Ryan
Adroitness,2,Passive,No,Choose general skill. Reduce time required by 25%.,CCC-Swordbreaker
Familiar,2,Passive,Yes,Choose silhouette 0 creature as familiar. Bond persists as chosen. Familiar acts telepathically but only exchange actions for maneuvers. Assist magic checks from short range.,CCC-ESP77
Fighter's Stance,2,Active (Incidental),No,When making combat check if performed Guarded Stance suffer 1 strain to ignore penalties.,CCC-ESP77
Pact Magic,2,Passive,No,Entered Pact with otherworldly being. Choose one spell type normally cannot cast. Once per encounter cast using any magic skill. GM spends help to inflict wound.,CCC-ESP77
Prepared Spell,2,Active (Action),No,Once per session make spell casting check without suffering strain.,CCC-TheSapient
Blindsense,3,Passive,Yes,As long as can hear ignore setback from darkness or blindness within short range.,CCC-ESP77
Blood Magic,3,Active (Incidental),No,When casting spell take two wounds instead of two strain.,CCC-ESP77
Bonded Implement,3,Active (Action),No,Choose magical implement and bond to it. No other may use. Summon with Hard Magic check. Select new if lost or destroyed.,CCC-TheSapient
Combat Caster,3,Passive,No,Once per session add Deadly quality to spell without increasing difficulty.,CCC-ESP77
Distant Spell,3,Passive,No,Once per session first range enhancement does not increase spell difficulty.,CCC-ESP77
Familiar (Improved),3,Active (Action),No,Must have Familiar talent. Suffer 2 strain and make Easy Magic check to see using familiar senses one round. Familiar assists with two setbacks.,CCC-ESP77
Forbidden Knowledge,3,Active (Maneuver),No,Once per session suffer strain up to Knowledge ranks to increase Knowledge ranks by equal for spell effect strength determination. Temporary ranks may exceed 5.,CCC-Klort
Life or Death,3,Passive,No,When suffering wounds equal to half threshold add setback to combat checks.,CCC-Swordbreaker
Lingering Spell,3,Active (Incidental),No,Spend Story Point to make concentration maneuver as incidental.,CCC-TheSapient
Magic Resistance,3,Passive,Yes,Spell casters add setback to checks. Add setback when making negative magic effect resistance checks.,CCC-Klort
Maximize Spell,3,Active (Incidental),Yes,Once per session add setback per rank to spell casting check.,CCC-ESP77
Overchannel (Improved),3,Passive,No,Must have Overchannel talent. Add double difficulty effects. Gain one despair per effect instead of increasing difficulty.,CCC-ESP77
Pinning Fire,3,Active (Action),Yes,Select target within range and make Pinning Fire action. Target adds setback per rank and suffers 1 strain until next turn.,CCC-Tom Cruise
Shape Spell,3,Active (Incidental),Yes,When casting Blast spell spend advantage to exclude 1 target per rank.,CCC-ESP77
Shield Master,3,Active (Maneuver),No,While wielding shield take maneuver suffering 1 strain. Shield Defensive and Deflection increase by 1 each until end of next turn.,CCC-Direach
Sneak Attack,3,Active (Incidental),No,Once per round when performing Aim maneuver suffer 1 strain to add Pierce 2 or increase Pierce by 1.,CCC-yeti1069
Turn Undead,3,Active (Action),Yes,Force all undead within short range to make fear check with difficulty equal to Discipline. Failed check forces moving away spending maneuvers.,CCC-ESP77
Assassin Strike,4,Active (Incidental),No,After successful melee check spend Story Point to disengage as incidental.,CCC-Tom Cruise
Blood Magic (Improved),4,Active (Incidental),No,Must have Blood Magic talent. Once per encounter suffer additional 2 wounds to add one effect difficulty modifier without increasing difficulty.,CCC-ESP77
Faith Healing,4,Active (Incidental),Yes,After Heal spell check change one success to advantage per rank.,CCC-TheSapient
Familiar (Supreme),4,Active (Incidental),No,Must have Familiar talent. Spend Story Point to use familiar as spell origin point.,CCC-ESP77
Finesse (Improved),4,Passive,No,Must have Finesse talent. Use Agility instead of Brawn for Brawl and Melee (Light) base damage.,CCC-Dragonshadow
Flurry of Blows,4,Active (Maneuver),No,Perform maneuver suffering strain up to Coordination ranks. Gain Linked quality equal to strain on next Melee or Brawl check.,CCC-Klort
Life or Death (Improved),4,Passive,No,Must have Life or Death talent. When suffering half or more wounds upgrade combat checks ability.,CCC-Swordbreaker
Mage Hunter,4,Active (Action),Yes,When targeted by curse spell make Daunting Discipline check to remove status. Reduce difficulty per rank.,CCC-ESP77
Mystic Theurge (Improved),4,Passive,No,Must have Mystic Theurge talent. No longer limits magic skill use to once per encounter.,CCC-yeti1069
Pinning Fire (Improved),4,Active (Action),No,Must have Pinning Fire talent. Affect multiple targets equal to Pinning Fire ranks.,CCC-Tom Cruise
Quickened Spell,4,Active (Maneuver),No,Once per session suffer 2 strain to make magic check as maneuver.,CCC-ESP77
Reflexive Barrier,4,Active (Incidental; Out of Turn),No,Once per session when targeted by attack cast Barrier as out-of-turn incidental.,CCC-ESP77
Sneak Attack (Improved),4,Active (Incidental),No,Must have Sneak Attack talent. Once per round when Aiming suffer 1 strain to add Vicious 2 or increase Vicious by 1.,CCC-Richardbuxton
Vision of the Future,4,Active (Incidental),No,Once per session after successful spell spend advantages or triumph to add effect normally increasing difficulty by 1.,CCC-TheSapient
Barbaric Strength,5,Passive,No,Use Melee (Heavy) weapons one-handed using Melee (Heavy) skill.,CCC-Klort
Blood Magic (Supreme),5,Active (Incidental),No,Once per session suffer critical. Decrease next spell check difficulty by three minimum Average.,CCC-ESP77
Bouncing Spell,5,Active (Incidental),No,When spell casting fails targeting character or NPC spend triumph or advantages to reroll with new target.,CCC-TheSapient
Sneak Attack (Supreme),5,Active (Incidental),No,Must have Sneak Attack talent. Once per encounter spend Story Point to add triumph to Attack action without usual successes.,CCC-Richardbuxton
Turn Undead (Improved),5,Active (Incidental),No,When taking Turn Undead action flip Story Point to deal 2 strain per rank to failed creatures. Perform Concentration maneuver to maintain subsequent rounds.,CCC-ESP77